{
  "schema_version": "v1",
  "project": "dnsmasq",
  "cve": "CVE-2017-14491",
  "entrypoints": [
    {
      "id": "EP-001",
      "function": "receive_query",
      "file": "src/forward.c",
      "line": 1117,
      "status": "kept",
      "trigger_type": "event",
      "trigger_ref": "Inbound UDP DNS query on a dnsmasq listener fd. Called from the dnsmasq main event loop in src/dnsmasq.c when select() reports the UDP listener readable.",
      "reachability": "Reached for every inbound UDP DNS packet on the host. Hot path.",
      "attacker_controllability": "High. The function ingests attacker-supplied bytes via recvmsg into daemon->packet and treats them as a DNS query.",
      "assumptions": [
        "dnsmasq is running and listening on a UDP DNS port (default 53).",
        "dnsmasq is configured with at least one local zone or auth zone — otherwise the local-answer path through answer_request is not taken and the heap overflow is unreachable. Forwarder-only configurations are not affected by this exact path."
      ],
      "supporting_substrate_edges": [
        "trust_boundaries[kind=network_socket, function=receive_query, file=src/forward.c:1117]",
        "call_graph[caller=receive_query, callee=answer_request, file=src/forward.c:1439]"
      ],
      "confidence": "high",
      "uncertainty": "Reachability of the bug also depends on what local zones the deployment configures, which is environment-specific."
    },
    {
      "id": "EP-002",
      "function": "tcp_request",
      "file": "src/forward.c",
      "line": 1604,
      "status": "kept",
      "trigger_type": "event",
      "trigger_ref": "Inbound TCP DNS connection on a dnsmasq listener. Called per-connection from the main loop after accept(), at src/dnsmasq.c:1709.",
      "reachability": "Reached for every TCP DNS connection. dnsmasq forks/threads per TCP connection so this is per-attacker-connection.",
      "attacker_controllability": "High. Same as EP-001 but with a 65535-byte limit (TCP DNS framing) instead of UDP-size limit.",
      "assumptions": [
        "dnsmasq is listening on TCP port 53.",
        "Same auth/local-zone configuration assumption as EP-001."
      ],
      "supporting_substrate_edges": [
        "trust_boundaries[kind=network_socket, function=tcp_request, file=src/forward.c:1604]",
        "call_graph[caller=tcp_request, callee=answer_request, file=src/forward.c:1774]"
      ],
      "confidence": "high",
      "uncertainty": "TCP path uses a larger limit (header+65536) which makes the overflow-by-2 less interesting in practice; the UDP path is the primary CVE vector."
    }
  ]
}
