{
  "schema_version": "v1",
  "project": "mbedtls",
  "cve": "CVE-2018-0488",
  "entrypoints": [
    {
      "id": "EP-001",
      "function": "mbedtls_ssl_read",
      "file": "library/ssl_tls.c",
      "line": 6759,
      "trigger_type": "event",
      "trigger_description": "Application calls mbedtls_ssl_read() to receive data over an established TLS/DTLS connection. The network peer (attacker) controls the record content sent. Any application data record sent after a handshake that negotiated CBC + truncated HMAC triggers the vulnerable ssl_decrypt_buf path.",
      "attacker_controllability": "high",
      "reachability": "direct",
      "supporting_substrate_edges": [
        "mbedtls_ssl_read → mbedtls_ssl_read_record (library/ssl_tls.c:6861)",
        "mbedtls_ssl_read_record → mbedtls_ssl_read_record_layer (library/ssl_tls.c:3734)",
        "mbedtls_ssl_read_record_layer → ssl_prepare_record_content (library/ssl_tls.c:3936)",
        "ssl_prepare_record_content → ssl_decrypt_buf (library/ssl_tls.c:3677)",
        "ssl_decrypt_buf → mbedtls_md_hmac_finish (library/ssl_tls.c:1968)"
      ],
      "confidence": "high",
      "uncertainty": "None. mbedtls_ssl_read is the documented public API for reading TLS application data and is the sole network trust boundary entry for the ssl_decrypt_buf path.",
      "status": "kept"
    }
  ]
}
