{
  "schema_version": "v1",
  "project": "u-boot",
  "cve": "CVE-2018-3968",
  "entrypoints": [
    {
      "id": "EP-001",
      "function": "do_bootm",
      "file": "common/cmd_bootm.c",
      "line": 786,
      "status": "kept",
      "trigger_type": "command",
      "trigger_ref": "U_BOOT_CMD(bootm, ...) at common/cmd_bootm.c:1071-1074 registers do_bootm as the handler for the 'bootm' shell command. Triggered when the U-Boot command parser dispatches the 'bootm' command from a shell prompt, a boot script (e.g. boot.scr loaded from an SD card), or the bootcmd environment variable executed at boot time.",
      "reachability": "Reachable on every U-Boot board with CONFIG_BOOTM (default on essentially every board). The bootm command is the canonical Linux-kernel-launching command in U-Boot. On embedded devices with a fixed boot script, do_bootm is invoked unattended on every power cycle.",
      "attacker_controllability": "The image at the load address is attacker-controlled in any threat model where the attacker can: write to NAND/SPI/eMMC flash, mount removable media (USB/SD), inject responses to network boot (tftp/dhcp), or modify the boot script. In the CVE-2018-3968 advisory the original report (Cisco Talos against the Cujo Smart Firewall) described an attacker who could supply the kernel image to a device that thought it required signed FIT images.",
      "assumptions": [
        "CONFIG_BOOTM is enabled in the build (effectively universal on Linux-launching boards).",
        "CONFIG_FIT and CONFIG_FIT_SIGNATURE are enabled (the only configuration in which the bypass is meaningful — without CONFIG_FIT_SIGNATURE there is no signature requirement to bypass).",
        "CONFIG_IMAGE_FORMAT_LEGACY effectively defined (always true in vulnerable_commit because the symbol is introduced only by the fix commit 21d29f7f)."
      ],
      "supporting_substrate_edges": [
        "callback_registrations[0]: U_BOOT_CMD(bootm, ...) → do_bootm at common/cmd_bootm.c:1071",
        "trust_boundaries[0]: do_bootm at common/cmd_bootm.c:786 marked external_io / untrusted_to_trusted (image bytes at load_addr)",
        "call_graph: do_bootm → do_bootm_states at common/cmd_bootm.c:825"
      ],
      "confidence": "high",
      "uncertainty": "None on the entrypoint itself: U_BOOT_CMD-registered handlers are unambiguously command entrypoints. The attacker-controllability surface depends on the specific deployment (some embedded boards have read-only flash + secure boot ROM upstream of U-Boot) — but the libc-level reachability of do_bootm given a writable boot medium is universal."
    },
    {
      "id": "EP-002",
      "function": "bootm_find_os",
      "file": "common/cmd_bootm.c",
      "line": 217,
      "status": "kept",
      "trigger_type": "event",
      "trigger_ref": "Internal call from do_bootm_states at common/cmd_bootm.c:646 when BOOTM_STATE_FINDOS is in the requested states mask. do_bootm always requests this state (line 826).",
      "reachability": "Always reached when do_bootm runs successfully past bootm_start. This is the function that calls boot_get_kernel and then re-dispatches on genimg_get_format to populate images.os.{type,comp,os,end,load} from the legacy or FIT header.",
      "attacker_controllability": "The argument os_hdr (line 224) is the kernel image header pointer returned by boot_get_kernel — same attacker-controlled bytes as do_bootm's load address.",
      "assumptions": [
        "do_bootm has been called and reached BOOTM_STATE_FINDOS — the default states mask requested by do_bootm at line 826 includes this."
      ],
      "supporting_substrate_edges": [
        "call_graph: do_bootm_states → bootm_find_os at common/cmd_bootm.c:646",
        "call_graph: bootm_find_os → boot_get_kernel at common/cmd_bootm.c:224",
        "call_graph: bootm_find_os → genimg_get_format at common/cmd_bootm.c:232"
      ],
      "confidence": "high",
      "uncertainty": "None. This function is the canonical OS-finding step inside the bootm state machine."
    },
    {
      "id": "EP-003",
      "function": "boot_get_kernel",
      "file": "common/cmd_bootm.c",
      "line": 913,
      "status": "kept",
      "trigger_type": "event",
      "trigger_ref": "Internal call from bootm_find_os at common/cmd_bootm.c:224. Also called from cmd_bootm.c image_info / do_imls paths but those do not load+execute, only print.",
      "reachability": "Reached on every successful bootm path. This is the function whose switch on genimg_get_format dispatches to either the LEGACY or FIT branch — the structural decision point for the bypass.",
      "attacker_controllability": "Direct: img_addr (line 928 / 942) comes from argv[0] of the bootm command (or load_addr default), which is whatever bytes the attacker placed at that physical address.",
      "assumptions": [
        "boot_get_kernel is called from bootm_find_os, which is called from do_bootm_states with the BOOTM_STATE_FINDOS bit set."
      ],
      "supporting_substrate_edges": [
        "call_graph: bootm_find_os → boot_get_kernel at common/cmd_bootm.c:224",
        "call_graph: boot_get_kernel → genimg_get_format at common/cmd_bootm.c:954",
        "call_graph: boot_get_kernel → image_get_kernel at common/cmd_bootm.c:958"
      ],
      "confidence": "high",
      "uncertainty": "None on reachability; full attacker-controllability of img_addr is conditional on the deployment's writability of the load region."
    },
    {
      "id": "EP-004",
      "function": "genimg_get_format",
      "file": "common/image.c",
      "line": 655,
      "status": "kept",
      "trigger_type": "event",
      "trigger_ref": "Internal helper called from boot_get_kernel (cmd_bootm.c:954), bootm_find_os (cmd_bootm.c:232), and several other image-handling paths in cmd_bootm.c (image_info, do_imls). The call from boot_get_kernel at line 954 is the relevant one for the bypass.",
      "reachability": "Always reached on every bootm path. Its return value is the *only* control flow that decides whether the kernel goes through the legacy CRC-only path or the FIT signature-aware path.",
      "attacker_controllability": "The img_addr argument is attacker-controlled (same provenance as EP-003). The function inspects the first 4 bytes (image_check_magic line 661) and returns IMAGE_FORMAT_LEGACY if they equal IH_MAGIC=0x27051956 — easy to forge.",
      "assumptions": [
        "boot_get_kernel has resolved the image address and called genimg_get_format with attacker bytes."
      ],
      "supporting_substrate_edges": [
        "data_control_flow[0]: genimg_get_format format-selection branch at common/image.c:660-672",
        "guards[0]: image_check_magic at common/image.c:661 selects LEGACY without authenticity guard"
      ],
      "confidence": "high",
      "uncertainty": "None. genimg_get_format is the structural pivot of the bypass; the gold IR-001 sink at common/image.c:662 is the moment the legacy branch is selected."
    }
  ]
}
