{
  "schema_version": "v1",
  "project": "nginx",
  "cve": "CVE-2025-23419",
  "entrypoints": [
    {
      "id": "EP-001",
      "function": "ngx_http_ssl_servername",
      "file": "src/http/ngx_http_request.c",
      "line": 875,
      "status": "kept",
      "trigger_type": "callback",
      "trigger_ref": "Registered as the OpenSSL SNI callback by SSL_CTX_set_tlsext_servername_callback(conf->ssl.ctx, ngx_http_ssl_servername) at src/http/modules/ngx_http_ssl_module.c:742-743. Triggered by OpenSSL when a ClientHello with SNI extension arrives. For TLS 1.3 + session resumption, the callback runs *after* OpenSSL has already resumed the session in the default SSL_CTX.",
      "reachability": "Reached on every TLS connection that supplies SNI to a listen socket configured with ssl_certificate. Always reached on the attack path for this CVE.",
      "attacker_controllability": "The remote peer fully controls the ClientHello: SNI, the session ticket presented for resumption, and the protocol version. Attacker chooses which vhost to resume against.",
      "assumptions": [
        "Build has --with-http_ssl_module (default for any HTTPS-serving nginx).",
        "OpenSSL ≥1.1.1 is linked (LibreSSL and BoringSSL are not affected; the fix is gated on `defined TLS1_3_VERSION && !defined LIBRESSL_VERSION_NUMBER && !defined OPENSSL_IS_BORINGSSL`).",
        "Server config has at least one ssl_session_cache zone or ssl_session_tickets enabled — without session resumption there is no way to reach the cross-SNI state."
      ],
      "supporting_substrate_edges": [
        "callback_registrations[0]: SSL_CTX_set_tlsext_servername_callback at src/http/modules/ngx_http_ssl_module.c:742 → ngx_http_ssl_servername",
        "trust_boundaries[0]: ngx_http_init_connection at src/http/ngx_http_request.c:200 (network_socket / untrusted_to_trusted)",
        "data_control_flow[0]: SNI callback branch structure in ngx_http_ssl_servername"
      ],
      "confidence": "high",
      "uncertainty": "None on the entrypoint itself. The cross-SNI reachability depends on the operator's vhost configuration (default vhost vs. strict vhost on the same IP/port), which is exactly the deployment shape the advisory targets."
    },
    {
      "id": "EP-002",
      "function": "ngx_stream_ssl_servername",
      "file": "src/stream/ngx_stream_ssl_module.c",
      "line": 534,
      "status": "kept",
      "trigger_type": "callback",
      "trigger_ref": "Registered as the OpenSSL SNI callback by SSL_CTX_set_tlsext_servername_callback(conf->ssl.ctx, ngx_stream_ssl_servername) at src/stream/ngx_stream_ssl_module.c:971-972. Symmetric to EP-001 for the nginx stream module (TCP/UDP proxying with TLS).",
      "reachability": "Reached on every stream-TLS connection that supplies SNI to a listen socket in the stream module.",
      "attacker_controllability": "Same as EP-001 — remote peer fully controls ClientHello.",
      "assumptions": [
        "Build has --with-stream_ssl_module.",
        "OpenSSL ≥1.1.1 is linked.",
        "Stream config has session resumption enabled."
      ],
      "supporting_substrate_edges": [
        "callback_registrations[1]: SSL_CTX_set_tlsext_servername_callback at src/stream/ngx_stream_ssl_module.c:971 → ngx_stream_ssl_servername",
        "trust_boundaries[1]: ngx_stream_ssl_servername at src/stream/ngx_stream_ssl_module.c:534 (network_socket / untrusted_to_trusted)"
      ],
      "confidence": "high",
      "uncertainty": "Stream module is less commonly deployed than HTTP — but the bug is structurally identical and the fix patches both modules in the same commit."
    },
    {
      "id": "EP-003",
      "function": "ngx_http_init_connection",
      "file": "src/http/ngx_http_request.c",
      "line": 200,
      "status": "kept",
      "trigger_type": "callback",
      "trigger_ref": "Installed as the listen-socket connection handler by ngx_http_add_listening / ngx_http_init_listening (set up at config-load time). Called by the ngx_event accept loop on every new TCP connection to an HTTP listen socket.",
      "reachability": "Reached on every new TCP connection to any HTTP-server listen address.",
      "attacker_controllability": "Remote peer initiates the TCP connection. The function looks up the per-address ngx_http_addr_conf and, if SSL is enabled (line 329), installs ngx_http_ssl_handshake as the read-event handler (line 332).",
      "assumptions": [
        "Build has --with-http_ssl_module."
      ],
      "supporting_substrate_edges": [
        "callback_registrations[2]: rev->handler = ngx_http_ssl_handshake at src/http/ngx_http_request.c:332",
        "trust_boundaries[0]: ngx_http_init_connection at src/http/ngx_http_request.c:200 (network_socket / untrusted_to_trusted)"
      ],
      "confidence": "high",
      "uncertainty": "None. This is the canonical HTTP connection-init function and is reached on every accept()."
    }
  ]
}
