{
  "schema_version": "v1",
  "project": "contiki-ng",
  "cve": "CVE-2021-21281",
  "entrypoints": [
    {
      "id": "EP-001",
      "function": "tcpip_input",
      "file": "os/net/ipv6/tcpip.c",
      "line": 445,
      "status": "kept",
      "trigger_type": "event",
      "trigger_ref": "Inbound IPv6 datagram delivered from the link/6LoWPAN layer",
      "reachability": "Reached for every received IPv6 datagram on a Contiki-NG node. The platform's lower layer (sicslowpan or a direct radio adapter) hands packets up by calling this function.",
      "attacker_controllability": "High. Any device that can place a raw IPv6 packet on the same network can drive this entrypoint with attacker-chosen header bytes.",
      "assumptions": [
        "The node has a working IPv6/6LoWPAN stack",
        "UIP_TCP is enabled in project-conf so the TCP path inside uip_process is compiled in"
      ],
      "supporting_substrate_edges": [
        "trust_boundaries[kind=network_socket, function=tcpip_input]",
        "call_graph[caller=input_callback, callee=tcpip_input]",
        "call_graph[caller=tcpip_input, callee=process_post_synch] (eventually dispatches to packet_input -> uip_input -> uip_process)"
      ],
      "confidence": "high",
      "uncertainty": "Some boards/tests may bypass tcpip_input and call uip_process directly; that variant is captured by EP-003."
    },
    {
      "id": "EP-002",
      "function": "input_callback",
      "file": "os/net/ipv6/sicslowpan.c",
      "line": 2056,
      "status": "kept",
      "trigger_type": "event",
      "trigger_ref": "6LoWPAN reassembly completion (radio frame -> IPv6 datagram)",
      "reachability": "Called by the 6LoWPAN module when a reassembled datagram is ready. Standard delivery path on 802.15.4 nodes, which is the common Contiki-NG deployment.",
      "attacker_controllability": "High on 6LoWPAN networks. Attacker controls the underlying frame contents and therefore the reassembled datagram.",
      "assumptions": [
        "Stack is built with 6LoWPAN (sicslowpan) enabled",
        "Reassembly succeeds (attacker can satisfy this with valid fragmentation)"
      ],
      "supporting_substrate_edges": [
        "call_graph[caller=input_callback, callee=tcpip_input, file=sicslowpan.c]",
        "trust_boundaries[function=input_callback, kind=network_socket]"
      ],
      "confidence": "high",
      "uncertainty": "Non-6LoWPAN platforms (e.g. native target with tap interface) take a different lower-layer path but still funnel into tcpip_input."
    },
    {
      "id": "EP-003",
      "function": "uip_process",
      "file": "os/net/ipv6/uip6.c",
      "line": 948,
      "status": "kept",
      "trigger_type": "callback",
      "trigger_ref": "Direct call sites: uip_udp_packet_send (uip-udp-packet.c:58), esmrf_in (multicast/esmrf.c:232)",
      "reachability": "Called directly with UIP_DATA / UIP_UDP_SEND_CONN flags from a small set of explicit call sites in addition to the macro chain via packet_input. The TCP-vulnerable label-block at uip6.c:1605 is reached when the parsed protocol is UIP_PROTO_TCP.",
      "attacker_controllability": "Indirect. The direct call sites still receive packet bytes from external sources.",
      "assumptions": [
        "uip_buf already populated with the inbound packet on entry",
        "Protocol field in the IPv6 header is UIP_PROTO_TCP for the vulnerable arithmetic to trigger"
      ],
      "supporting_substrate_edges": [
        "call_graph[caller=packet_input, callee=uip_process]",
        "call_graph[caller=uip_udp_packet_send, callee=uip_process]",
        "call_graph[caller=esmrf_in, callee=uip_process]"
      ],
      "confidence": "high",
      "uncertainty": "Direct call sites (UDP send, multicast) do not themselves take the TCP code path. They are listed because they are entrypoints into uip_process; the vulnerable branch is gated by IP protocol = TCP."
    },
    {
      "id": "EP-Q-001",
      "function": "uip_send",
      "file": "os/net/ipv6/uip6.c",
      "line": null,
      "status": "quarantined",
      "trigger_type": "unknown",
      "reachability": "Application-side helper for sending TCP data. Not an inbound packet entrypoint.",
      "attacker_controllability": "Low. Driven by application logic, not network input.",
      "assumptions": [],
      "supporting_substrate_edges": [],
      "refuting_substrate_edges": [
        "trust_boundaries do not list uip_send as an external-input boundary",
        "uip_send is on the egress path; the vulnerability is on the ingress path"
      ],
      "quarantine_reason": "On the wrong direction (egress vs the inbound vulnerable parsing path). Kept here for audit so that Step 3 retrieval can confirm it is not part of any vulnerable IR.",
      "confidence": "high",
      "uncertainty": "If a future variant of the vulnerability shows up on the egress side, this should be revisited."
    }
  ]
}
