{
  "schema_version": "v1",
  "project": "libssh",
  "cve": "CVE-2018-10933",
  "entrypoints": [
    {
      "id": "EP-001",
      "function": "ssh_packet_socket_callback",
      "file": "src/packet.c",
      "line": 144,
      "status": "kept",
      "trigger_type": "callback",
      "trigger_ref": "Registered as session->socket_callbacks.data by ssh_packet_register_socket_callback (src/packet.c:405-406) and propagated to the socket layer at src/packet.c:410. Invoked by the libssh socket subsystem whenever bytes arrive from the SSH peer.",
      "reachability": "Reached for every inbound SSH packet on a libssh-based server (and client). Hot path of any active SSH session.",
      "attacker_controllability": "High. The function's first parameter is a pointer to attacker-supplied bytes lifted directly from the wire.",
      "assumptions": [
        "The libssh build was compiled with WITH_SERVER (otherwise the server-side dispatch path is not present, but the client-side variant of the same bug is reachable too).",
        "TCP connection has been established and KEX/transport handshake has completed enough to deliver packets to this dispatcher."
      ],
      "supporting_substrate_edges": [
        "trust_boundaries[kind=network_socket, function=ssh_packet_socket_callback]",
        "callback_registrations[callback_function=ssh_packet_socket_callback, file=src/packet.c:406]",
        "call_graph[caller=ssh_packet_socket_callback, callee=ssh_packet_process, file=src/packet.c:350]"
      ],
      "confidence": "high",
      "uncertainty": "The exact handshake-stage gating depends on what the lower socket layer delivers; for the auth-bypass path we only need the session to be past KEX completion."
    },
    {
      "id": "EP-002",
      "function": "ssh_packet_process",
      "file": "src/packet.c",
      "line": 440,
      "status": "kept",
      "trigger_type": "callback",
      "trigger_ref": "Direct call from ssh_packet_socket_callback at src/packet.c:350 with the attacker-supplied session->in_packet.type as second argument. Indirect entry point for the dispatch table.",
      "reachability": "Always reached after a complete packet header is parsed in ssh_packet_socket_callback. Called once per inbound packet.",
      "attacker_controllability": "High. The 'type' argument is the wire byte the attacker chose; the dispatcher uses it as an index into the callback table.",
      "assumptions": [
        "session->packet_callbacks list has been populated (default_packet_handlers registered).",
        "Same WITH_SERVER assumption as EP-001 for the server-side variant."
      ],
      "supporting_substrate_edges": [
        "call_graph[caller=ssh_packet_socket_callback, callee=ssh_packet_process, file=src/packet.c:350]",
        "call_graph[caller=ssh_packet_process, callee=ssh_packet_userauth_success, kind=indirect, file=src/packet.c:463]",
        "callback_registrations[registration_site=default_packet_handlers, file=src/packet.c:90]"
      ],
      "confidence": "high",
      "uncertainty": "Treated here as an entry point because it is the first frame where attacker control of the dispatch index materially decides which handler runs. Could equivalently be modeled as an intermediate node in EP-001's path."
    },
    {
      "id": "EP-Q-001",
      "function": "ssh_packet_userauth_request",
      "file": "src/messages.c",
      "line": 703,
      "status": "quarantined",
      "trigger_type": "unknown",
      "trigger_ref": "trigger_type marked 'unknown' because ssh_packet_userauth_request is the legitimate server-side authentication entry. It is reached via the same dispatch table (default_packet_handlers index 50) but does NOT participate in the bypass; it implements the credential-checking path the bypass avoids. 'unknown' is recorded with this note rather than 'callback' because tagging it 'callback' would imply equivalence to the bypass path EP-001/EP-002, which is misleading.",
      "reachability": "Reached when an honest client sends SSH2_MSG_USERAUTH_REQUEST. Not on the exploit path.",
      "attacker_controllability": "Medium-low: attacker controls the inbound message but the function itself enforces credential checks.",
      "assumptions": [],
      "supporting_substrate_edges": [],
      "refuting_substrate_edges": [
        "call_graph[caller=ssh_packet_process, callee=ssh_packet_userauth_request] is the legitimate path; it is NOT the path that sets session_state to AUTHENTICATED without credentials."
      ],
      "quarantine_reason": "On the legitimate authentication path. The CVE bypass is precisely the ability to skip this function. Recorded for audit so that Step 3 retrieval can confirm the exploit path does not traverse it.",
      "confidence": "high",
      "uncertainty": "If a future variant of this CVE turns out to chain through a partial USERAUTH_REQUEST (e.g., none-method) followed by USERAUTH_SUCCESS, this entry should be revisited."
    }
  ]
}
