{
  "schema_version": "v1",
  "project": "lwip",
  "cve": "CVE-2020-22283",
  "entrypoints": [
    {
      "id": "EP-001",
      "function": "tcp_input",
      "file": "src/core/tcp_in.c",
      "line": 118,
      "status": "kept",
      "trigger_type": "event",
      "trigger_ref": "Inbound TCP segment delivered from the network interface driver to the IP layer, which calls tcp_input. In lwIP's single-threaded model this happens synchronously in the packet receive path.",
      "reachability": "Reached for every inbound TCP packet on any active TCP connection. Hot path — attacker simply needs an established TCP connection to the lwIP device.",
      "attacker_controllability": "High. tcphdr->wnd (the TCP advertised window) at tcp_in.c:232 is taken directly from the wire with only lwip_ntohs byte-swap applied. The attacker controls the entire wnd field (16 bits, 0..65535).",
      "assumptions": [
        "Attacker has an established TCP connection to the lwIP-based device (e.g. a TCP server application running on it).",
        "lwIP is configured with LWIP_TCP=1 (default)."
      ],
      "supporting_substrate_edges": [
        "trust_boundaries[kind=network_socket, function=tcp_input, file=src/core/tcp_in.c:118]",
        "call_graph[caller=tcp_input, callee=tcp_receive, file=src/core/tcp_in.c:995]"
      ],
      "confidence": "high",
      "uncertainty": "Exact dispatch path from ip_input to tcp_input depends on netif configuration; confirmed as the standard lwIP TCP receive entry for all established connections."
    },
    {
      "id": "EP-002",
      "function": "tcp_tmr",
      "file": "src/core/tcp.c",
      "line": 234,
      "status": "kept",
      "trigger_type": "callback",
      "trigger_ref": "Registered as a cyclic timer in lwip_cyclic_timers[] at src/core/timeouts.c:81 with interval TCP_TMR_INTERVAL (250 ms). Every other invocation of tcp_tmr calls tcp_slowtmr (every 500 ms), which handles persist-mode probing including the double-free path.",
      "reachability": "Fires automatically every 500 ms for any lwIP instance with active TCP PCBs. No attacker interaction required at the timer-fire moment — the attacker only needs to have pre-conditioned the PCB (via EP-001) into persist mode with a non-zero snd_wnd.",
      "attacker_controllability": "Indirect. The attacker does not control when tcp_tmr fires but pre-conditions the PCB state (persist_backoff > 0, snd_wnd > 0, unsent segment present) via TCP window advertisements from EP-001.",
      "assumptions": [
        "The lwIP application calls sys_check_timeouts() (or the integrator's equivalent) regularly so that the cyclic timer fires.",
        "A TCP PCB exists in ESTABLISHED state with pcb->persist_backoff > 0 and pcb->unsent != NULL and pcb->snd_wnd > 0 at timer-fire time."
      ],
      "supporting_substrate_edges": [
        "callback_registrations[kind=struct_initializer, registered_callback=tcp_tmr, file=src/core/timeouts.c:81]",
        "call_graph[caller=tcp_tmr, callee=tcp_slowtmr, file=src/core/tcp.c:242]",
        "call_graph[caller=tcp_slowtmr, callee=tcp_split_unsent_seg, file=src/core/tcp.c:1258]"
      ],
      "confidence": "high",
      "uncertainty": "The persist-probe timer backoff table means the double-free triggers only when persist_cnt reaches the backoff threshold — at minimum one 500 ms tick, in practice several seconds after persist mode is entered."
    }
  ]
}
