{
  "schema_version": "v1",
  "project": "sudo",
  "cve": "CVE-2021-3156",
  "entrypoints": [
    {
      "id": "EP-001",
      "function": "sudoers_policy_check",
      "file": "plugins/sudoers/policy.c",
      "line": 1013,
      "status": "kept",
      "trigger_type": "callback",
      "trigger_ref": "sudoers_policy_check is registered as the check_policy function pointer in the sudoers_policy struct at plugins/sudoers/policy.c:1172. The sudo front-end dynamically loads the policy plugin and calls check_policy() for each invocation of sudo or sudoedit.",
      "reachability": "Reached for every invocation of 'sudo' or 'sudoedit' on a system with the sudoers policy plugin. sudo is setuid-root, so the plugin runs with elevated privileges immediately. The vulnerability is triggered before any sudoers file check.",
      "attacker_controllability": "High. The argc/argv arguments to sudoers_policy_check are derived from the attacker's command line. For sudoedit, argv contains the files to edit — the attacker controls their content, including whether they end in a backslash. The sudo_mode flags (MODE_EDIT, MODE_SHELL) are also set from the attacker's command-line flags (-e/-s).",
      "assumptions": [
        "sudo is installed and setuid-root (default on all major Linux distributions).",
        "The sudoers plugin (libsudoers.so or sudoers.so) is the configured policy plugin (default).",
        "sudoedit -s is invoked with an argument ending in backslash and at least one more argument."
      ],
      "supporting_substrate_edges": [
        "trust_boundaries[kind=cli_argument, function=sudoers_policy_check, file=plugins/sudoers/policy.c:1013]",
        "callback_registrations[kind=struct_initializer, registered_callback=sudoers_policy_check, file=plugins/sudoers/policy.c:1172]",
        "call_graph[caller=sudoers_policy_check, callee=sudoers_policy_main, file=plugins/sudoers/policy.c:1028]"
      ],
      "confidence": "high",
      "uncertainty": "No uncertainty about reachability — this is the direct and only entry to the sudoers plugin for all sudo invocations."
    }
  ]
}
